{
  "user": {
    "ageNow": 34,
    "ageTarget": 50,
    "household": "couple",
    "region": "London",
    "fireFlavour": "standard",
    "displayName": "Sample User"
  },
  "cashflow": {
    "monthlyNetIncome": 5400,
    "monthlySpend": 3850,
    "monthlySurplus": 1550,
    "savingsRatePct": 29,
    "monthlyPensionContributions": 750
  },
  "netWorth": {
    "cash": 28000,
    "pensions": 95000,
    "isasGia": 62000,
    "propertyEquity": 145000,
    "otherAssets": 0,
    "mortgage": 285000,
    "otherDebt": 4500,
    "total": 40500,
    "investedTotal": 185000
  },
  "spendByCategory": [
    { "name": "Housing",                  "monthly": 1450, "benchmarkMonthly": 840,  "deltaPct": 73 },
    { "name": "Food & Groceries",         "monthly": 480,  "benchmarkMonthly": 390,  "deltaPct": 23 },
    { "name": "Transport",                "monthly": 320,  "benchmarkMonthly": 450,  "deltaPct": -29 },
    { "name": "Discretionary",            "monthly": 720,  "benchmarkMonthly": 540,  "deltaPct": 33 },
    { "name": "Communication",            "monthly": 95,   "benchmarkMonthly": 80,   "deltaPct": 19 },
    { "name": "Clothing & Footwear",      "monthly": 110,  "benchmarkMonthly": 125,  "deltaPct": -12 },
    { "name": "Household Goods & Services", "monthly": 180, "benchmarkMonthly": 210, "deltaPct": -14 },
    { "name": "Insurance & Misc",         "monthly": 220,  "benchmarkMonthly": 200,  "deltaPct": 10 },
    { "name": "Other",                    "monthly": 275,  "benchmarkMonthly": 75,   "deltaPct": 267 }
  ],
  "fire": {
    "annualSpendInRetirement": 46200,
    "fireNumber": 1155000,
    "withdrawalRatePct": 4,
    "yearsToFire": 18,
    "projectedAgeAtFire": 52,
    "realReturnAssumptionPct": 5,
    "spendMultiplier": 1.0,
    "trajectory": [
      { "year": 2026, "netWorth": 185000 },
      { "year": 2027, "netWorth": 222850 },
      { "year": 2028, "netWorth": 262593 },
      { "year": 2029, "netWorth": 304322 },
      { "year": 2030, "netWorth": 348138 },
      { "year": 2031, "netWorth": 394145 },
      { "year": 2032, "netWorth": 442452 },
      { "year": 2033, "netWorth": 493175 },
      { "year": 2034, "netWorth": 546434 },
      { "year": 2035, "netWorth": 602356 },
      { "year": 2036, "netWorth": 661074 },
      { "year": 2037, "netWorth": 722728 },
      { "year": 2038, "netWorth": 787464 },
      { "year": 2039, "netWorth": 855437 },
      { "year": 2040, "netWorth": 926809 },
      { "year": 2041, "netWorth": 1001750 },
      { "year": 2042, "netWorth": 1080437 },
      { "year": 2043, "netWorth": 1163059 },
      { "year": 2044, "netWorth": 1249812 },
      { "year": 2045, "netWorth": 1340903 },
      { "year": 2046, "netWorth": 1436548 },
      { "year": 2047, "netWorth": 1536975 },
      { "year": 2048, "netWorth": 1642424 }
    ]
  },
  "rag": {
    "savingsRate": "GREEN",
    "emergencyFund": "GREEN",
    "investmentAllocation": "GREEN",
    "trajectory": "AMBER"
  },
  "recommendations": [
    {
      "title": "Discretionary spend is ~33% above the UK average for couples",
      "rationale": "You're spending around £720/month on recreation, dining, and entertainment vs a UK couple average of £540. London skews this benchmark, but it's still worth knowing where the gap is. If even £100/month of this is reflexive rather than deliberate, redirecting it could matter.",
      "expectedImpact": "Redirecting £100/month into investments could bring your FIRE date forward by ~1 year."
    },
    {
      "title": "Your Other category looks unusually high — worth investigating",
      "rationale": "The Other bucket came in at £275/month vs a typical £75. This often means there are subscriptions, fees, or one-offs we haven't categorised. A 30-minute audit of the last 3 months could surface where this is going.",
      "expectedImpact": "If half of this is recoverable, that's ~£100/month back — same as recommendation 1, additive."
    },
    {
      "title": "Confirm you're capturing your full employer pension match",
      "rationale": "Your savings rate is healthy at 29%, but the single highest-leverage move for most employees is making sure they're not leaving any employer match on the table. If your employer matches above what you currently contribute, increasing to capture it is essentially a guaranteed return.",
      "expectedImpact": "Worth checking before any other change — could be the cheapest year of FIRE you'll ever buy."
    }
  ],
  "meta": {
    "generatedAt": "2026-05-02T18:00:00Z",
    "skillVersion": "0.1.0",
    "monzoConnected": true,
    "benchmarkSourceYear": "2023"
  }
}
